{"iter": 20, "messages": [{"role": "system", "content": "You are an autonomous training-loop research agent. Your job is to find a\nsmall perturbation to a 354M-parameter GPT pretrain configuration that\nlowers validation cross-entropy on a held-out wikitext-103 slice.\n\nYou can twist exactly ONE knob per iteration. Your output MUST be a\nsingle JSON object on one line, with exactly these three keys:\n\n    {\"knob\": \"<knob name>\", \"new_value\": <value>, \"reason\": \"<one short sentence>\"}\n\nConstraints:\n- knob must be from the allowlist below\n- new_value must be the right type and within the declared range or choices\n- reason is a single sentence, \u2264 200 characters\n- DO NOT output anything else \u2014 no preamble, no markdown, no code block fences\n- DO NOT propose the same knob and value as the last accepted state\n\nIf you cannot decide, propose the most informative change you have not tried."}, {"role": "user", "content": "## Allowlisted knobs\n\n  - n_layer  (int, range=[4, 48])  default=24  // transformer block count\n  - n_head  (int, choices=[4, 8, 16, 32])  default=16  // attention heads (must divide d_model)\n  - d_model  (int, choices=[256, 512, 768, 1024, 1536, 2048])  default=1024  // hidden dim (must be divisible by n_head)\n  - d_ff  (int, choices=[1024, 2048, 4096, 6144, 8192])  default=4096  // FFN hidden dim\n  - lr  (float, range=[1e-05, 0.01])  default=0.0003  // AdamW peak learning rate\n  - lr_warmup  (int, range=[0, 50])  default=5  // warmup steps before cosine decay\n  - grad_clip  (float, range=[0.1, 5.0])  default=1.0  // gradient clip norm\n  - weight_decay  (float, range=[0.0, 0.5])  default=0.0  // AdamW weight_decay\n  - beta1  (float, range=[0.5, 0.99])  default=0.9  // AdamW beta1\n  - beta2  (float, range=[0.8, 0.9999])  default=0.95  // AdamW beta2\n  - batch_size  (int, choices=[2, 4, 8, 16])  default=16  // micro-batch (A2 envelope)\n  - seq_len  (int, choices=[512, 1024, 2048])  default=1024  // sequence length\n  - precision  (str, choices=['bf16', 'fp8'])  default=fp8  // compute precision\n\n## Current cfg (baseline since last accepted change)\n\n{\n  \"n_layer\": 24,\n  \"n_head\": 16,\n  \"d_model\": 768,\n  \"d_ff\": 4096,\n  \"lr\": 0.0003,\n  \"lr_warmup\": 5,\n  \"grad_clip\": 1.0,\n  \"weight_decay\": 0.0,\n  \"beta1\": 0.9,\n  \"beta2\": 0.95,\n  \"batch_size\": 16,\n  \"seq_len\": 1024,\n  \"precision\": \"fp8\",\n  \"vocab_size\": 50257,\n  \"steps\": 60,\n  \"val_chunk_tokens\": 16384,\n  \"seed\": 0\n}\n\n## Recent iterations\n\n  iter  15  lr=0.0002                     applied; val_bpb 10.9554\u219211.1329; decision=revert\n  iter  16  n_head=32                     applied; val_bpb 10.9554\u219210.935; decision=revert\n  iter  17  d_ff=8192                     applied; val_bpb 10.9554\u219210.9566; decision=revert\n  iter  18  n_head=8                      applied; val_bpb 10.9554\u219210.9371; decision=revert\n  iter  19  d_model=1536                  applied; val_bpb 10.9554\u219210.9767; decision=revert\n\n## Your task\n\nPropose ONE knob change that you think will improve val_bpb. Output JSON only."}, {"role": "assistant", "content": "{\"knob\": \"beta1\", \"new_value\": 0.92, \"reason\": \"slightly increase beta1 to encourage faster convergence\"}"}], "decision": "revert", "val_bpb": 10.9616, "improvement_frac": -0.0006}
{"iter": 21, "messages": [{"role": "system", "content": "You are an autonomous training-loop research agent. Your job is to find a\nsmall perturbation to a 354M-parameter GPT pretrain configuration that\nlowers validation cross-entropy on a held-out wikitext-103 slice.\n\nYou can twist exactly ONE knob per iteration. Your output MUST be a\nsingle JSON object on one line, with exactly these three keys:\n\n    {\"knob\": \"<knob name>\", \"new_value\": <value>, \"reason\": \"<one short sentence>\"}\n\nConstraints:\n- knob must be from the allowlist below\n- new_value must be the right type and within the declared range or choices\n- reason is a single sentence, \u2264 200 characters\n- DO NOT output anything else \u2014 no preamble, no markdown, no code block fences\n- DO NOT propose the same knob and value as the last accepted state\n\nIf you cannot decide, propose the most informative change you have not tried."}, {"role": "user", "content": "## Allowlisted knobs\n\n  - n_layer  (int, range=[4, 48])  default=24  // transformer block count\n  - n_head  (int, choices=[4, 8, 16, 32])  default=16  // attention heads (must divide d_model)\n  - d_model  (int, choices=[256, 512, 768, 1024, 1536, 2048])  default=1024  // hidden dim (must be divisible by n_head)\n  - d_ff  (int, choices=[1024, 2048, 4096, 6144, 8192])  default=4096  // FFN hidden dim\n  - lr  (float, range=[1e-05, 0.01])  default=0.0003  // AdamW peak learning rate\n  - lr_warmup  (int, range=[0, 50])  default=5  // warmup steps before cosine decay\n  - grad_clip  (float, range=[0.1, 5.0])  default=1.0  // gradient clip norm\n  - weight_decay  (float, range=[0.0, 0.5])  default=0.0  // AdamW weight_decay\n  - beta1  (float, range=[0.5, 0.99])  default=0.9  // AdamW beta1\n  - beta2  (float, range=[0.8, 0.9999])  default=0.95  // AdamW beta2\n  - batch_size  (int, choices=[2, 4, 8, 16])  default=16  // micro-batch (A2 envelope)\n  - seq_len  (int, choices=[512, 1024, 2048])  default=1024  // sequence length\n  - precision  (str, choices=['bf16', 'fp8'])  default=fp8  // compute precision\n\n## Current cfg (baseline since last accepted change)\n\n{\n  \"n_layer\": 24,\n  \"n_head\": 16,\n  \"d_model\": 768,\n  \"d_ff\": 4096,\n  \"lr\": 0.0003,\n  \"lr_warmup\": 5,\n  \"grad_clip\": 1.0,\n  \"weight_decay\": 0.0,\n  \"beta1\": 0.9,\n  \"beta2\": 0.95,\n  \"batch_size\": 16,\n  \"seq_len\": 1024,\n  \"precision\": \"fp8\",\n  \"vocab_size\": 50257,\n  \"steps\": 60,\n  \"val_chunk_tokens\": 16384,\n  \"seed\": 0\n}\n\n## Recent iterations\n\n  iter  16  n_head=32                     applied; val_bpb 10.9554\u219210.935; decision=revert\n  iter  17  d_ff=8192                     applied; val_bpb 10.9554\u219210.9566; decision=revert\n  iter  18  n_head=8                      applied; val_bpb 10.9554\u219210.9371; decision=revert\n  iter  19  d_model=1536                  applied; val_bpb 10.9554\u219210.9767; decision=revert\n  iter  20  beta1=0.92                    applied; val_bpb 10.9554\u219210.9616; decision=revert\n\n## Your task\n\nPropose ONE knob change that you think will improve val_bpb. Output JSON only."}, {"role": "assistant", "content": "{\"knob\": \"beta2\", \"new_value\": 0.92, \"reason\": \"slightly lower beta2 to stabilize training\"}"}], "decision": "revert", "val_bpb": 10.9524, "improvement_frac": 0.0003}
{"iter": 22, "messages": [{"role": "system", "content": "You are an autonomous training-loop research agent. Your job is to find a\nsmall perturbation to a 354M-parameter GPT pretrain configuration that\nlowers validation cross-entropy on a held-out wikitext-103 slice.\n\nYou can twist exactly ONE knob per iteration. Your output MUST be a\nsingle JSON object on one line, with exactly these three keys:\n\n    {\"knob\": \"<knob name>\", \"new_value\": <value>, \"reason\": \"<one short sentence>\"}\n\nConstraints:\n- knob must be from the allowlist below\n- new_value must be the right type and within the declared range or choices\n- reason is a single sentence, \u2264 200 characters\n- DO NOT output anything else \u2014 no preamble, no markdown, no code block fences\n- DO NOT propose the same knob and value as the last accepted state\n\nIf you cannot decide, propose the most informative change you have not tried."}, {"role": "user", "content": "## Allowlisted knobs\n\n  - n_layer  (int, range=[4, 48])  default=24  // transformer block count\n  - n_head  (int, choices=[4, 8, 16, 32])  default=16  // attention heads (must divide d_model)\n  - d_model  (int, choices=[256, 512, 768, 1024, 1536, 2048])  default=1024  // hidden dim (must be divisible by n_head)\n  - d_ff  (int, choices=[1024, 2048, 4096, 6144, 8192])  default=4096  // FFN hidden dim\n  - lr  (float, range=[1e-05, 0.01])  default=0.0003  // AdamW peak learning rate\n  - lr_warmup  (int, range=[0, 50])  default=5  // warmup steps before cosine decay\n  - grad_clip  (float, range=[0.1, 5.0])  default=1.0  // gradient clip norm\n  - weight_decay  (float, range=[0.0, 0.5])  default=0.0  // AdamW weight_decay\n  - beta1  (float, range=[0.5, 0.99])  default=0.9  // AdamW beta1\n  - beta2  (float, range=[0.8, 0.9999])  default=0.95  // AdamW beta2\n  - batch_size  (int, choices=[2, 4, 8, 16])  default=16  // micro-batch (A2 envelope)\n  - seq_len  (int, choices=[512, 1024, 2048])  default=1024  // sequence length\n  - precision  (str, choices=['bf16', 'fp8'])  default=fp8  // compute precision\n\n## Current cfg (baseline since last accepted change)\n\n{\n  \"n_layer\": 24,\n  \"n_head\": 16,\n  \"d_model\": 768,\n  \"d_ff\": 4096,\n  \"lr\": 0.0003,\n  \"lr_warmup\": 5,\n  \"grad_clip\": 1.0,\n  \"weight_decay\": 0.0,\n  \"beta1\": 0.9,\n  \"beta2\": 0.95,\n  \"batch_size\": 16,\n  \"seq_len\": 1024,\n  \"precision\": \"fp8\",\n  \"vocab_size\": 50257,\n  \"steps\": 60,\n  \"val_chunk_tokens\": 16384,\n  \"seed\": 0\n}\n\n## Recent iterations\n\n  iter  17  d_ff=8192                     applied; val_bpb 10.9554\u219210.9566; decision=revert\n  iter  18  n_head=8                      applied; val_bpb 10.9554\u219210.9371; decision=revert\n  iter  19  d_model=1536                  applied; val_bpb 10.9554\u219210.9767; decision=revert\n  iter  20  beta1=0.92                    applied; val_bpb 10.9554\u219210.9616; decision=revert\n  iter  21  beta2=0.92                    applied; val_bpb 10.9554\u219210.9524; decision=revert\n\n## Your task\n\nPropose ONE knob change that you think will improve val_bpb. Output JSON only."}, {"role": "assistant", "content": "{\"knob\": \"n_head\", \"new_value\": 32, \"reason\": \"Increase attention heads to improve model capacity.\"}"}], "decision": "revert", "val_bpb": 10.9618, "improvement_frac": -0.0006}
{"iter": 23, "messages": [{"role": "system", "content": "You are an autonomous training-loop research agent. Your job is to find a\nsmall perturbation to a 354M-parameter GPT pretrain configuration that\nlowers validation cross-entropy on a held-out wikitext-103 slice.\n\nYou can twist exactly ONE knob per iteration. Your output MUST be a\nsingle JSON object on one line, with exactly these three keys:\n\n    {\"knob\": \"<knob name>\", \"new_value\": <value>, \"reason\": \"<one short sentence>\"}\n\nConstraints:\n- knob must be from the allowlist below\n- new_value must be the right type and within the declared range or choices\n- reason is a single sentence, \u2264 200 characters\n- DO NOT output anything else \u2014 no preamble, no markdown, no code block fences\n- DO NOT propose the same knob and value as the last accepted state\n\nIf you cannot decide, propose the most informative change you have not tried."}, {"role": "user", "content": "## Allowlisted knobs\n\n  - n_layer  (int, range=[4, 48])  default=24  // transformer block count\n  - n_head  (int, choices=[4, 8, 16, 32])  default=16  // attention heads (must divide d_model)\n  - d_model  (int, choices=[256, 512, 768, 1024, 1536, 2048])  default=1024  // hidden dim (must be divisible by n_head)\n  - d_ff  (int, choices=[1024, 2048, 4096, 6144, 8192])  default=4096  // FFN hidden dim\n  - lr  (float, range=[1e-05, 0.01])  default=0.0003  // AdamW peak learning rate\n  - lr_warmup  (int, range=[0, 50])  default=5  // warmup steps before cosine decay\n  - grad_clip  (float, range=[0.1, 5.0])  default=1.0  // gradient clip norm\n  - weight_decay  (float, range=[0.0, 0.5])  default=0.0  // AdamW weight_decay\n  - beta1  (float, range=[0.5, 0.99])  default=0.9  // AdamW beta1\n  - beta2  (float, range=[0.8, 0.9999])  default=0.95  // AdamW beta2\n  - batch_size  (int, choices=[2, 4, 8, 16])  default=16  // micro-batch (A2 envelope)\n  - seq_len  (int, choices=[512, 1024, 2048])  default=1024  // sequence length\n  - precision  (str, choices=['bf16', 'fp8'])  default=fp8  // compute precision\n\n## Current cfg (baseline since last accepted change)\n\n{\n  \"n_layer\": 24,\n  \"n_head\": 16,\n  \"d_model\": 768,\n  \"d_ff\": 4096,\n  \"lr\": 0.0003,\n  \"lr_warmup\": 5,\n  \"grad_clip\": 1.0,\n  \"weight_decay\": 0.0,\n  \"beta1\": 0.9,\n  \"beta2\": 0.95,\n  \"batch_size\": 16,\n  \"seq_len\": 1024,\n  \"precision\": \"fp8\",\n  \"vocab_size\": 50257,\n  \"steps\": 60,\n  \"val_chunk_tokens\": 16384,\n  \"seed\": 0\n}\n\n## Recent iterations\n\n  iter  18  n_head=8                      applied; val_bpb 10.9554\u219210.9371; decision=revert\n  iter  19  d_model=1536                  applied; val_bpb 10.9554\u219210.9767; decision=revert\n  iter  20  beta1=0.92                    applied; val_bpb 10.9554\u219210.9616; decision=revert\n  iter  21  beta2=0.92                    applied; val_bpb 10.9554\u219210.9524; decision=revert\n  iter  22  n_head=32                     applied; val_bpb 10.9554\u219210.9618; decision=revert\n\n## Your task\n\nPropose ONE knob change that you think will improve val_bpb. Output JSON only."}, {"role": "assistant", "content": "{\"knob\": \"d_model\", \"new_value\": 768, \"reason\": \"smaller hidden dim may reduce overfitting\"}"}], "decision": "keep", "val_bpb": 10.8575, "improvement_frac": 0.0089}
{"iter": 24, "messages": [{"role": "system", "content": "You are an autonomous training-loop research agent. Your job is to find a\nsmall perturbation to a 354M-parameter GPT pretrain configuration that\nlowers validation cross-entropy on a held-out wikitext-103 slice.\n\nYou can twist exactly ONE knob per iteration. Your output MUST be a\nsingle JSON object on one line, with exactly these three keys:\n\n    {\"knob\": \"<knob name>\", \"new_value\": <value>, \"reason\": \"<one short sentence>\"}\n\nConstraints:\n- knob must be from the allowlist below\n- new_value must be the right type and within the declared range or choices\n- reason is a single sentence, \u2264 200 characters\n- DO NOT output anything else \u2014 no preamble, no markdown, no code block fences\n- DO NOT propose the same knob and value as the last accepted state\n\nIf you cannot decide, propose the most informative change you have not tried."}, {"role": "user", "content": "## Allowlisted knobs\n\n  - n_layer  (int, range=[4, 48])  default=24  // transformer block count\n  - n_head  (int, choices=[4, 8, 16, 32])  default=16  // attention heads (must divide d_model)\n  - d_model  (int, choices=[256, 512, 768, 1024, 1536, 2048])  default=1024  // hidden dim (must be divisible by n_head)\n  - d_ff  (int, choices=[1024, 2048, 4096, 6144, 8192])  default=4096  // FFN hidden dim\n  - lr  (float, range=[1e-05, 0.01])  default=0.0003  // AdamW peak learning rate\n  - lr_warmup  (int, range=[0, 50])  default=5  // warmup steps before cosine decay\n  - grad_clip  (float, range=[0.1, 5.0])  default=1.0  // gradient clip norm\n  - weight_decay  (float, range=[0.0, 0.5])  default=0.0  // AdamW weight_decay\n  - beta1  (float, range=[0.5, 0.99])  default=0.9  // AdamW beta1\n  - beta2  (float, range=[0.8, 0.9999])  default=0.95  // AdamW beta2\n  - batch_size  (int, choices=[2, 4, 8, 16])  default=16  // micro-batch (A2 envelope)\n  - seq_len  (int, choices=[512, 1024, 2048])  default=1024  // sequence length\n  - precision  (str, choices=['bf16', 'fp8'])  default=fp8  // compute precision\n\n## Current cfg (baseline since last accepted change)\n\n{\n  \"n_layer\": 24,\n  \"n_head\": 16,\n  \"d_model\": 768,\n  \"d_ff\": 4096,\n  \"lr\": 0.0003,\n  \"lr_warmup\": 5,\n  \"grad_clip\": 1.0,\n  \"weight_decay\": 0.0,\n  \"beta1\": 0.9,\n  \"beta2\": 0.95,\n  \"batch_size\": 16,\n  \"seq_len\": 1024,\n  \"precision\": \"fp8\",\n  \"vocab_size\": 50257,\n  \"steps\": 60,\n  \"val_chunk_tokens\": 16384,\n  \"seed\": 0\n}\n\n## Recent iterations\n\n  iter  19  d_model=1536                  applied; val_bpb 10.9554\u219210.9767; decision=revert\n  iter  20  beta1=0.92                    applied; val_bpb 10.9554\u219210.9616; decision=revert\n  iter  21  beta2=0.92                    applied; val_bpb 10.9554\u219210.9524; decision=revert\n  iter  22  n_head=32                     applied; val_bpb 10.9554\u219210.9618; decision=revert\n  iter  23  d_model=768                   applied; val_bpb 10.9554\u219210.8575; decision=keep\n\n## Your task\n\nPropose ONE knob change that you think will improve val_bpb. Output JSON only."}, {"role": "assistant", "content": "{\"knob\": \"d_model\", \"new_value\": 2048, \"reason\": \"Increase hidden dimension for better representation capacity\"}"}], "decision": "revert", "val_bpb": 10.9479, "improvement_frac": 0.0007}
{"iter": 25, "messages": [{"role": "system", "content": "You are an autonomous training-loop research agent. Your job is to find a\nsmall perturbation to a 354M-parameter GPT pretrain configuration that\nlowers validation cross-entropy on a held-out wikitext-103 slice.\n\nYou can twist exactly ONE knob per iteration. Your output MUST be a\nsingle JSON object on one line, with exactly these three keys:\n\n    {\"knob\": \"<knob name>\", \"new_value\": <value>, \"reason\": \"<one short sentence>\"}\n\nConstraints:\n- knob must be from the allowlist below\n- new_value must be the right type and within the declared range or choices\n- reason is a single sentence, \u2264 200 characters\n- DO NOT output anything else \u2014 no preamble, no markdown, no code block fences\n- DO NOT propose the same knob and value as the last accepted state\n\nIf you cannot decide, propose the most informative change you have not tried."}, {"role": "user", "content": "## Allowlisted knobs\n\n  - n_layer  (int, range=[4, 48])  default=24  // transformer block count\n  - n_head  (int, choices=[4, 8, 16, 32])  default=16  // attention heads (must divide d_model)\n  - d_model  (int, choices=[256, 512, 768, 1024, 1536, 2048])  default=1024  // hidden dim (must be divisible by n_head)\n  - d_ff  (int, choices=[1024, 2048, 4096, 6144, 8192])  default=4096  // FFN hidden dim\n  - lr  (float, range=[1e-05, 0.01])  default=0.0003  // AdamW peak learning rate\n  - lr_warmup  (int, range=[0, 50])  default=5  // warmup steps before cosine decay\n  - grad_clip  (float, range=[0.1, 5.0])  default=1.0  // gradient clip norm\n  - weight_decay  (float, range=[0.0, 0.5])  default=0.0  // AdamW weight_decay\n  - beta1  (float, range=[0.5, 0.99])  default=0.9  // AdamW beta1\n  - beta2  (float, range=[0.8, 0.9999])  default=0.95  // AdamW beta2\n  - batch_size  (int, choices=[2, 4, 8, 16])  default=16  // micro-batch (A2 envelope)\n  - seq_len  (int, choices=[512, 1024, 2048])  default=1024  // sequence length\n  - precision  (str, choices=['bf16', 'fp8'])  default=fp8  // compute precision\n\n## Current cfg (baseline since last accepted change)\n\n{\n  \"n_layer\": 24,\n  \"n_head\": 16,\n  \"d_model\": 768,\n  \"d_ff\": 4096,\n  \"lr\": 0.0003,\n  \"lr_warmup\": 5,\n  \"grad_clip\": 1.0,\n  \"weight_decay\": 0.0,\n  \"beta1\": 0.9,\n  \"beta2\": 0.95,\n  \"batch_size\": 16,\n  \"seq_len\": 1024,\n  \"precision\": \"fp8\",\n  \"vocab_size\": 50257,\n  \"steps\": 60,\n  \"val_chunk_tokens\": 16384,\n  \"seed\": 0\n}\n\n## Recent iterations\n\n  iter  20  beta1=0.92                    applied; val_bpb 10.9554\u219210.9616; decision=revert\n  iter  21  beta2=0.92                    applied; val_bpb 10.9554\u219210.9524; decision=revert\n  iter  22  n_head=32                     applied; val_bpb 10.9554\u219210.9618; decision=revert\n  iter  23  d_model=768                   applied; val_bpb 10.9554\u219210.8575; decision=keep\n  iter  24  d_model=2048                  applied; val_bpb 10.9554\u219210.9479; decision=revert\n\n## Your task\n\nPropose ONE knob change that you think will improve val_bpb. Output JSON only."}, {"role": "assistant", "content": "{\"knob\": \"beta2\", \"new_value\": 0.96, \"reason\": \"slightly increase beta2 for more aggressive decay\"}"}], "decision": "revert", "val_bpb": 10.9335, "improvement_frac": 0.002}
